{
  "manifest_version": 1,
  "dataset_version": "da-daka-<fingerprint-prefix>",
  "dataset_fingerprint": "<64 lowercase SHA-256 characters>",
  "created_at_utc": "<generated UTC timestamp>",
  "git_commit": "<builder git commit>",
  "sources": [
    {
      "source_task": "capture_session_a",
      "source_path": "/read-only/source/task_a_backup.zip",
      "source_sha256": "<64 lowercase SHA-256 characters>",
      "source_type": "cvat_backup",
      "image_count": 0
    }
  ],
  "split_policy": {
    "unit_priority": ["panel_group", "burst_group", "capture_session", "source_task"],
    "seed": "da-daka-split-v1",
    "ratios": [0.7, 0.15, 0.15]
  },
  "counts": {
    "images": 0,
    "annotations": 0,
    "clean_images": 0,
    "dirty_images": 0,
    "by_split": {"train": 0, "validation": 0, "test": 0}
  },
  "category_contract": {"solar_panel": 1, "dirt": 2}
}
